<?xml version="1.0" encoding="UTF-8"?>
<!DOCTYPE xml>
<families xmlns="http://www.myschema.by/families" xmlns:xsi="http://www.w3.org/2001/XMLSchema-instance"
	xsi:schemaLocation="http://www.myschema.by/families familiesSchema.xsd">

	<family name="Ivanovy">
		<parents>
			<mother>
				<name>Lena</name>
				<surname>Ivanova</surname>
				<age>20</age>
				<maiden-name>Sidorova</maiden-name>
                <children count="3"/>
			</mother>
			<father>
				<name>Ivan</name>
				<surname>Ivanov</surname>
				<age>21</age>
			</father>
		</parents>
	</family>

	<family name="Petrovy">
		<parents>
			<mother>
				<name>Katia</name>
				<surname>Petrova</surname>
				<age>30</age>
				<maiden-name>Frolova</maiden-name>
				<children count="2"/>
			</mother>
			<father>
				<name>Petr</name>
				<surname>Petrov</surname>
				<age>31</age>
			</father>
		</parents>
	</family>
</families>